<?xml version="1.0" encoding="UTF-8"?>
<!--
To change this license header, choose License Headers in Project Properties.
To change this template file, choose Tools | Templates
and open the template in the editor.
-->


<dynamic_root
    xmlns:xsi='http://www.w3.org/2001/XMLSchema-instance'
    xsi:noNamespaceSchemaLocation='dynamic.xsd'>

    <vxml_trace>
      <nodeid>2000</nodeid>
      <vxml_module>1</vxml_module>
      <vxml_tracemask>0</vxml_tracemask>
      <vxml_debugmask>0</vxml_debugmask>
     </vxml_trace>
     <vxml_trace>
      <nodeid>2000</nodeid>
      <vxml_module>2</vxml_module>
      <vxml_tracemask>0</vxml_tracemask>
      <vxml_debugmask>0</vxml_debugmask>
     </vxml_trace>
     <vxml_trace>
      <nodeid>2000</nodeid>
      <vxml_module>3</vxml_module>
      <vxml_tracemask>0</vxml_tracemask>
      <vxml_debugmask>0</vxml_debugmask>
     </vxml_trace>
     <vxml_trace>
      <nodeid>2000</nodeid>
      <vxml_module>4</vxml_module>
      <vxml_tracemask>0</vxml_tracemask>
      <vxml_debugmask>0</vxml_debugmask>
     </vxml_trace>
     <vxml_trace>
      <nodeid>2000</nodeid>
      <vxml_module>5</vxml_module>
      <vxml_tracemask>0</vxml_tracemask>
      <vxml_debugmask>0</vxml_debugmask>
     </vxml_trace>
     <vxml_trace>
      <nodeid>2000</nodeid>
      <vxml_module>6</vxml_module>
      <vxml_tracemask>0</vxml_tracemask>
      <vxml_debugmask>0</vxml_debugmask>
     </vxml_trace>
     <vxml_trace>
      <nodeid>2000</nodeid>
      <vxml_module>7</vxml_module>
      <vxml_tracemask>0</vxml_tracemask>
      <vxml_debugmask>0</vxml_debugmask>
     </vxml_trace>
     <vxml_trace>
      <nodeid>2000</nodeid>
      <vxml_module>8</vxml_module>
      <vxml_tracemask>0</vxml_tracemask>
      <vxml_debugmask>0</vxml_debugmask>
     </vxml_trace>
     <vxml_trace>
      <nodeid>2000</nodeid>
      <vxml_module>9</vxml_module>
      <vxml_tracemask>0</vxml_tracemask>
      <vxml_debugmask>0</vxml_debugmask>
     </vxml_trace>
     <vxml_trace>
      <nodeid>2000</nodeid>
      <vxml_module>10</vxml_module>
      <vxml_tracemask>0</vxml_tracemask>
      <vxml_debugmask>0</vxml_debugmask>
     </vxml_trace>
     <vxml_trace>
      <nodeid>2000</nodeid>
      <vxml_module>11</vxml_module>
      <vxml_tracemask>0</vxml_tracemask>
      <vxml_debugmask>0</vxml_debugmask>
     </vxml_trace>
     <vxml_trace>
      <nodeid>2000</nodeid>
      <vxml_module>12</vxml_module>
      <vxml_tracemask>0</vxml_tracemask>
      <vxml_debugmask>0</vxml_debugmask>
     </vxml_trace>
     <vxml_trace>
      <nodeid>2000</nodeid>
      <vxml_module>13</vxml_module>
      <vxml_tracemask>0</vxml_tracemask>
      <vxml_debugmask>0</vxml_debugmask>
     </vxml_trace>
     <vxml_trace>
      <nodeid>2000</nodeid>
      <vxml_module>14</vxml_module>
      <vxml_tracemask>0</vxml_tracemask>
      <vxml_debugmask>0</vxml_debugmask>
     </vxml_trace>
     <vxml_trace>
      <nodeid>2000</nodeid>
      <vxml_module>15</vxml_module>
      <vxml_tracemask>0</vxml_tracemask>
      <vxml_debugmask>0</vxml_debugmask>
     </vxml_trace>

</dynamic_root>
